Managed Fund Name,APIR,Fund Managers Name,URL
4D Global Infrastructure Fund,BFL0019AU,4D Global,www.4dinfra.com
AUSTRALIAN SMALL COMPANIES FUND,FHT0012AU,8IP,www.8ip.com.au
Inspire Australian Equities Fund,ETL6826AU,Inspire Australia,www.inspireaustralianequities.com.au
AB Alternative Risk Premia Fund,ACM1372AU,Alliance Berenstein,web.alliancebernstein.com
Aberdeen Standard Actively Hedged International Equities Fund,CRS0005AU,Aberdeen Standard,www.aberdeenstandard.com
Aberdeen Standard Australian Equities ,MGL0114AU,Aberdeen Standard,www.aberdeenstandard.com
Aberdeen Standard Australian Small Companies ,CSA0131AU,Aberdeen Standard,www.aberdeenstandard.com
Aberdeen Standard Emerging Market Local Currency Debt ,EQI0699AU,Aberdeen Standard,www.aberdeenstandard.com
Aberdeen Standard Emerging Opportunities , ETL0032AU,Aberdeen Standard,www.aberdeenstandard.com
Aberdeen Standard Ex-20 Australian Equities ,CRS0003AU,Aberdeen Standard,www.aberdeenstandard.com
Aberdeen Standard Fully Hedged International Equities ,CSA0135AU,Aberdeen Standard,www.aberdeenstandard.com
Aberdeen Standard Global Absolute Return Strategies ,ETL0130AU,Aberdeen Standard,www.aberdeenstandard.com
Aberdeen Standard International Equity ,EQI0015AU,Aberdeen Standard,www.aberdeenstandard.com
Aberdeen Standard Select Investment Actively Hedged International Equities ,CSA0114AU,Aberdeen Standard,www.aberdeenstandard.com
Acadian Aus Equity Long Short ,FSF0789AU,Acadian,www.acadian-asset.com
Acadian Defensive Income-Class A ,FSF0973AU,Acadian,www.acadian-asset.com
Acadian Global Managed Volatility Equity Fund ,FSF1240AU ,Acadian,www.acadian-asset.com
Acadian Wholesale Australian Equity Fund A ,FSF0787AU,Acadian,www.acadian-asset.com
Acadian Wholesale Geared Australian Equity Fund ,FSF0453AU,Acadian,www.acadian-asset.com
Acadian Wholesale Geared Global Equity Fund ,FSF0891AU,Acadian,www.acadian-asset.com
Acadian Wholesale Global Eqty Long Short ,FSF0788AU,Acadian,www.acadian-asset.com
Acadian Wholesale Sustainable Global Equity Fund ,FSF0710AU,Acadian,www.acadian-asset.com
Advance Australian Fixed Interest Index Wholesale ,ADV0064AU,Advance,www.advance.com.au/
Advance Australian Fixed Interest Multi Blend ,ADV0084AU,Advance,www.advance.com.au/
Advance Australian Property Securities Index Wholesale Units ,ADV0052AU,Advance,www.advance.com.au/
Advance Australian Shares Index Wholesale ,ADV0062AU,Advance,www.advance.com.au/
Advance Australian Shares Multi Blend ,ADV0045AU,Advance,www.advance.com.au/
Advance Balanced Multi Blend ,ADV0050AU,Advance,www.advance.com.au/
Advance Cash Management Trust ARS ,ADV0135AU,Advance,www.advance.com.au/
Advance Global Property ,ADV0135AU,Advance,www.advance.com.au/
Advance International Fixed Interest Index Wholesale ,ADV0058AU,Advance,www.advance.com.au/
Advance International Fixed Interest Multi Blend ,ADV0067AU,Advance,www.advance.com.au/
Advance International Shares Index Wholesale Units ,ADV0056AU,Advance,www.advance.com.au/
Advance International Shares Multi Blend ,ADV0053AU,Advance,www.advance.com.au/
Advance Property Securities Multi Blend ,ADV0095AU,Advance,www.advance.com.au/
Affluence Small Company ,AFX0240AU,Affluence,affluencefunds.com.au
Airlie Australian Share ,MGE9705AU,Arilie FundsManagement,www.airliefundsmanagement.com.au
Alexander Credit Income ,ETL2805AU,Alexander,www.alexanderfunds.com.au
Alexander Credit Opportunities ,OMF0005AU,Alexander,www.alexanderfunds.com.au
Allan Gray Australia Balanced ,ETL4654AU,Allan Gray,www.allangray.com.au
Allan Gray Australia Equity A ,ETL0060AU,Allan Gray,www.allangray.com.au
AllianceBernstein Concentrated Australian Equities ,ACM0005AU,Alliance Berenstein,web.alliancebernstein.com
AllianceBernstein Dynamic Global Fixed Income ,ACM0001AU,Alliance Berenstein,web.alliancebernstein.com
AllianceBernstein Global Equities ,ACM0009AU,Alliance Berenstein,web.alliancebernstein.com
AllianceBernstein Managed Volatility Equities ,ACM0006AU,Alliance Berenstein,web.alliancebernstein.com
Alpha Alternatives ,ETL0318AU,Alpha Fund Managers,alphafundmanagers.com.au
Alpha Australian Blue Chip ,ETL0091AU,Alpha Fund Managers,alphafundmanagers.com.au
Alpha Australian Small Companies ,ETL0092AU,Alpha Fund Managers,alphafundmanagers.com.au
Alpha Diversified Income ,ETL0329AU,Alpha Fund Managers,alphafundmanagers.com.au
Alpha Enhanced Yield ,ETL0093AU,Alpha Fund Managers,alphafundmanagers.com.au
Alpha Global Opportunities ,ETL0094AU,Alpha Fund Managers,alphafundmanagers.com.au
Alpha Infrastructure ,ETL0319AU,Alpha Fund Managers,alphafundmanagers.com.au
Alpha Property Securities ,ETL0095AU,Alpha Fund Managers,alphafundmanagers.com.au
Alphinity Australian Share B ,PAM0001AU,Alphinity,www.alphinity.com.au
Alphinity Concentrated Australian Share B ,HOW0026AU,Alphinity,www.alphinity.com.au
Alphinity Global Equity ,HOW0164AU,Alphinity,www.alphinity.com.au
Alphinity Sustainable Share ,HOW0121AU,Alphinity,www.alphinity.com.au
Altius Bond ,WFS0486AU,Australian Unity,www.australianunity.com.au
Altius Sustainable Bond ,AUS0071AU,Australian Unity,www.australianunity.com.au
Altrinsic Global Equities Trust ,ANT0005AU,MLC,www.mlc.com.au
AMP AB Advantage Dynamic Global Fixed Income ,AMP2066AU,AMP Capital,www.amp.com.au
AMP Antipodes Advantage Global Share ,AMP9989AU,AMP Capital,www.amp.com.au
AMP Arrowstreet Advantage Global Equity ,AMP8663AU,AMP Capital,www.amp.com.au
AMP Ausbil Advantage 130/30 Focus ,AAP0008AU,AMP Capital,www.amp.com.au
AMP Capital Advantage Core Infrastructure ,AMP1180AU,AMP Capital,www.ampcapital.com
AMP Capital Advantage Corporate Bond ,AMP0557AU,AMP Capital,www.ampcapital.com
AMP Capital Advantage Global Property Securities ,AMP0974AU,AMP Capital,www.ampcapital.com
AMP Capital Australian Emerging Companies A ,AMP6265AU,AMP Capital,www.ampcapital.com
AMP Capital Core Infrastructure ,AMP1179AU,AMP Capital,www.ampcapital.com
AMP Capital Core Property H ,AMP1015AU,AMP Capital,www.ampcapital.com
AMP Capital Corporate Bond ,AMP0557AU,AMP Capital,www.ampcapital.com
AMP Capital Enhanced Index Share A ,AMP0271AU,AMP Capital,www.ampcapital.com
AMP Capital Equity Income Generator,AMP1931AU,AMP Capital,www.ampcapital.com
AMP Capital Ethical Leaders International Share B ,AMP0455AU,AMP Capital,www.ampcapital.com
AMP Capital Future Directions International Bond A ,AMP0676AU,AMP Capital,www.ampcapital.com
AMP Capital Global Companies O ,AMP7497AU,AMP Capital,www.ampcapital.com
AMP Capital Global Infrastructure Securities Hedged H ,AMP1595AU,AMP Capital,www.ampcapital.com
AMP Capital Global Infrastructure Securities Unhedged R ,AMP1595AU,AMP Capital,www.ampcapital.com
AMP Capital Global Property Securities Fund ,AMP0974AU,AMP Capital,www.ampcapital.com
AMP Capital International Bond A ,AMP0268AU,AMP Capital,www.ampcapital.com
AMP Capital Listed Property Trusts A ,AMP0255AU,AMP Capital,www.ampcapital.com
AMP Capital Managed Treasury ,AMP0249AU,AMP Capital,www.ampcapital.com
AMP Capital Small Australian Companies H ,AMP0577AU,AMP Capital,www.ampcapital.com
AMP Capital Specialist Australian Share ,AMP0681AU,AMP Capital,www.ampcapital.com
AMP Capital Wholesale Australian Bond ,AMP0981AU,AMP Capital,www.ampcapital.com
AMP Experts' Choice Balanced ,HLR0003AU,AMP Capital,www.ampcapital.com
AMP Experts' Choice Diversified Interest Income ,HLR0001AU,AMP Capital,www.ampcapital.com
AMP Experts' Choice International Shares ,HLR0006AU,AMP Capital,www.ampcapital.com
AMP Experts' Choice Property and Infrastructure ,HLR0022AU,AMP Capital,www.ampcapital.com
AMP Experts' Choice Short Term Money Market ,HLR0007AU,AMP Capital,www.ampcapital.com
AMP Experts' Choice Small Companies ,HLR0023AU,AMP Capital,www.ampcapital.com
Antares Australian Equities Professional ,PPL0110AU,Antares Capital,www.antarescapital.com.au
Antares Dividend Builder Professional ,PPL0002AU,Antares Capital,www.antarescapital.com.au
Antares Elite Opportunities Professional ,PPL0115AU,Antares Capital,www.antarescapital.com.au
Antares High Growth Shares Personal ,PPL0106AU,Antares Capital,www.antarescapital.com.au
Antares Income ,PPL0028AU,Antares Capital,www.antarescapital.com.au
Antares Listed Property Personal ,NFS0209AU,Antares Capital,www.antarescapital.com.au
Antipodes Asia I ,IOF0203AU,Antipodes Partners,antipodespartners.com
Antipodes Global I ,IOF0045AU,Antipodes Partners,antipodespartners.com
Antipodes Global Long Only I ,WHT0057AU,Antipodes Partners,antipodespartners.com
Aoris International A ,PIM3513AU,Aoris,www.aoris.com.au
APN AREIT ,APN0008AU,APN Group,apngroup.com.au
APN Asian REIT ,APN0023AU,APN Group,apngroup.com.au
APN Property For Income 2 ,APN0004AU,APN Group,apngroup.com.au
APN Property For Income ,APN0001AU,APN Group,apngroup.com.au
APSEC Atlantic Pacific Australian Equity ,OMF0003AU,APSEC,www.apsec.com.au
AQR Wholesale DELTA ,PER0554AU,AQR,australia.aqr.com
AQR Wholesale Managed Futures ,PER0634AU,AQR,australia.aqr.com
Ardea ActiveX Ardea Real Outcome Bond A,HOW0098AU,Ardea,www.ardea.com.au
Ardea Australian Inflation Linked Bond A,HOW0062AU,Ardea,www.ardea.com.au
Ardea Diversified Bond A ,HOW8543AU,Ardea,www.ardea.com.au
Armytage Micro Cap Activist ,ETL3064AU,Armytage,www.armytage.com.au
Armytage Strategic Opportunities Ret ,ETL0139AU,Armytage,www.armytage.com.au
Artesian Corporate Bond A ,ETL8268AU,Artesian Invest,www.artesianinvest.com
Atlas High Income Property Ordinary ,OMF9290AU,Atlas Funds,atlasfunds.com.au
ATLAS Infrastructure Australian Feeder Hedged ,PIM9253AU ,Pan Tribal,www.pantribal.com.au
Atrium Evolution Series Diversified AEF 9 ,COL0031AU,Atrium,www.atriuminvest.com.au
Aurora Fortitude Absolute Return ,AFM0005AU,Aurora,www.aurorafunds.com.au
Ausbil 130/30 Focus Institutional ,AAP0008AU,Ausbil,www.ausbil.com.au
Ausbil 130/30 Focus Wholesale ,AAP0003AU,Ausbil,www.ausbil.com.au
Ausbil Active Sustainable Equity ,AAP3940AU,Ausbil,www.ausbil.com.au
Ausbil Australian Active Equity ,AAP0103AU,Ausbil,www.ausbil.com.au
Ausbil Australian Concentrated Equity ,AAP9227AU,Ausbil,www.ausbil.com.au
Ausbil Australian Emerging Leaders ,AAP0104AU,Ausbil,www.ausbil.com.au
Ausbil Candriam Sustainable Global Equity ,AAP0001AU,Ausbil,www.ausbil.com.au
Ausbil Global Essential Infrastructure ,AAP3601AU,Ausbil,www.ausbil.com.au
Ausbil Global Resources ,AAP5928AU,Ausbil,www.ausbil.com.au
Ausbil Global SmallCap ,AAP8285AU,Ausbil,www.ausbil.com.au
Ausbil MicroCap ,AAP0007AU,Ausbil,www.ausbil.com.au
Auscap Long Short Australian Equities ,ASX0001AU,AusCap,www.auscapam.com
Australian Ethical Advocacy ,AUG0008AU,Australian Ethical,www.australianethical.com.au
Australian Ethical Australian Shares ,AUG0002AU,Australian Ethical,www.australianethical.com.au
Australian Ethical Balanced Inc ,AUG0001AU,Australian Ethical,www.australianethical.com.au
Australian Ethical Diversified Shares ,AUG0004AU,Australian Ethical,www.australianethical.com.au
Australian Ethical Emerging Companies ,AUG0026AU,Australian Ethical,www.australianethical.com.au
Australian Ethical Fixed Interest ,AUG0021AU,Australian Ethical,www.australianethical.com.au
Australian Ethical Income ,AUG0003AU,Australian Ethical,www.australianethical.com.au
Australian Ethical International Shares ,AUG0006AU,Australian Ethical,www.australianethical.com.au
Aviva Investors Multi-Strategy Target Income ,PIM0037AU,Aviva,www.avivainvestors.com
Aviva Investors Multi-Strategy Target Return ,PIM0026AU,Aviva,www.avivainvestors.com
Bateau Global Opportunities ,SLT0068AU,Bateau,bateauam.com.au
Bell Global All Weather A ,BPF0002AU,Bell,www.bellasset.com.au
Bell Global Emerging Companies ,BPF0029AU,Bell,www.bellasset.com.au
Bell Global Equities Platform ,BPF0016AU,Bell,www.bellasset.com.au
Bell Global Pure Alpha A ,BPF0005AU,Bell,www.bellasset.com.au
Bendigo Adelaide Cash Management Trust ,AMF0100AU,Bendigo Bank,www.bendigobank.com.au
Bendigo Balanced Index ,STL0033AU,Bendigo Bank,www.bendigobank.com.au
Bendigo Balanced Wholesale ,STL0013AU,Bendigo Bank,www.bendigobank.com.au
Bendigo Diversified Fixed Interest ,STL0051AU,Bendigo Bank,www.bendigobank.com.au
Bennelong Australian Equities ,BFL0001AU,Baep,www.baep.com.au
Bennelong Concentrated Australian Equities ,BFL0002AU,Baep,www.baep.com.au
Bennelong Emerging Companies ,BFL3779AU,Baep,www.baep.com.au
Bennelong ex-20 Australian Equities ,BFL0004AU,Baep,www.baep.com.au
Bennelong Twenty20 Australian Equities ,BFL0017AU,Baep,www.baep.com.au
Bentham Asset backed Securities I ,HOW2852AU,Bentham Asset Management,www.benthamam.com
Bentham Global Income ,CSA0038AU,Bentham Asset Management,www.benthamam.com
Bentham Global Opportunities F ,HOW7031AU,Bentham Asset Management,www.benthamam.com
Bentham High Yield ,CSA0102AU,Bentham Asset Management,www.benthamam.com
Bentham Syndicated Loan NZD ,165696300,Bentham Asset Management,www.benthamam.com
Bentham Syndicated Loan ,CSA0046AU,Bentham Asset Management,www.benthamam.com
BlackRock Advantage Australian Equity ,BAR0814AU,BlackRock,www.blackrock.com
BlackRock Advantage Hedged International Equity ,BGL0109AU,BlackRock,www.blackrock.com
BlackRock Australian Alpha Tilts ,BGL0006AU,BlackRock,www.blackrock.com
BlackRock Australian Equity Market Neutral ,BGL0064AU,BlackRock,www.blackrock.com
BlackRock Australian Share Plus ,PWA0015AU,BlackRock,www.blackrock.com
BlackRock Australian Share ,PWA0014AU,BlackRock,www.blackrock.com
BlackRock Cash ,BGL0009AU,BlackRock,www.blackrock.com
BlackRock Enhanced Australian Bond ,BGL0060AU,BlackRock,www.blackrock.com
BlackRock Enhanced Cash H ,BLK0135AU,BlackRock,www.blackrock.com
BlackRock Equitised Long Short ,BGL0061AU,BlackRock,www.blackrock.com
BlackRock Equity ,PWA0001AU,BlackRock,www.blackrock.com
BlackRock Fission Indexed International Equity ,BGL0051AU,BlackRock,www.blackrock.com
BlackRock Fixed Income Global Opportunities Aust D ,BLK0003AU,BlackRock,www.blackrock.com
BlackRock Global Equity Signals D ,BLK5937AU,BlackRock,www.blackrock.com
BlackRock Global Listed Infrastructure ,BLK8833AU,BlackRock,www.blackrock.com
BlackRock International Alpha Tilts Active Currency and Country Hedged ,BGL0046AU,BlackRock,www.blackrock.com
BlackRock International Alpha Tilts Active Currency and Country ,BGL0047AU,BlackRock,www.blackrock.com
BlackRock International Alpha Tilts Hedged ,BGL0053AU,BlackRock,www.blackrock.com
BlackRock International Alpha Tilts ,BGL0001AU,BlackRock,www.blackrock.com
BlackRock iShares Wholesale Screened International Equity Index E ,BLK4380AU,BlackRock,www.blackrock.com
BlackRock Multi Opportunity Absolute Return ,BLK0001AU,BlackRock,www.blackrock.com
BlackRock Multi Opportunity ,BLK0001AU,BlackRock,www.blackrock.com
BlackRock Style Advantage E ,BLK0019AU,BlackRock,www.blackrock.com
BlackRock Wholesale International Bond ,PWA0825AU,BlackRock,www.blackrock.com
Bnp Paribas C Worldwide Global Equity Trust ,ARO0006AU,BNP Paribas,www.bnpparibas-am.com.au
BT Advance Australian Fixed Interest Multi Blend Retail ,ADV0084AU,BT,www.bt.com.au
BT Advance Australian Shares Multi-Blend Fund,ADV0045AU,BT,www.bt.com.au
Advance Defensive Yield Multi-Blend Fund,ADV0173AU,BT,www.bt.com.au
BT Advance Australian Smaller Companies Multi-Blend Fund,ADV0075AU,BT,www.bt.com.au
BT Australian Shares Index Fund,ADV0062AU,BT,www.bt.com.au
BT Multi-manager Australian Shares Fund,BTA0259AU,BT,www.bt.com.au
BT Wholesale Partner Australian Shares Core,BTA0241AU,BT,www.bt.com.au
BT Wholesale Partner Australian Shares Growth,BTA0242AU,BT,www.bt.com.au
BT Advance International Shares Multi-Blend Fund,ADV0053AU,BT,www.bt.com.au
BT Advance Asian Shares Multi-Blend Fund,ADV0083AU,BT,www.bt.com.au
BT Wholesale Partner International Shares Growth,ADV0056AU,BT,www.bt.com.au
BT Multi-manager International Shares Fund,BTA0261AU,BT,www.bt.com.au
BT Advance Property Securities Multi-Blend Fund,ADV0052AU,BT,www.bt.com.au
BT Australian Fixed Interest Index Fund,ADV0064AU,BT,www.bt.com.au
BT Advance International Fixed Interest Multi-Blend Fund,ADV0067AU,BT,www.bt.com.au
BT Multi-manager Fixed Interest Fund,BTA0260AU,BT,www.bt.com.au
BT International Fixed Interest Index Fund,ADV0058AU,BT,www.bt.com.au
BT Advance Cash Multi-Blend Fund,ADV0069AU,BT,www.bt.com.au
BT Premium Cash Fund,BTA0173AU,BT,www.bt.com.au
Capital Group Emerging Markets Total Opportunities (AU) ,CIM9121AU,Capital Group,www.capitalgroup.com
Capital Group Global Corporate Bond Hedged (AU) ,CIM0161AU,Capital Group,www.capitalgroup.com
Capital Group Global Equity (AU) ,WHT0044AU,Capital Group,www.capitalgroup.com
Capital Group Global High Income Opportunities Hedged (AU) ,CIM3839AU,Capital Group,www.capitalgroup.com
Capital Group New Perspective (AU) ,CIM0006AU,Capital Group,www.capitalgroup.com
Capital Group New Perspective Hedged (AU) ,CIM3839AU,Capital Group,www.capitalgroup.com
Capital Group New World (AU) ,CIM8680AU,Capital Group,www.capitalgroup.com
Capital Group World Dividend Growers (AU) ,CIM0002AU,Capital Group,www.capitalgroup.com
Centuria LifeGoals Pimco Global Bond Fund,OVS1514AU,Centuria,centuria.com.au
Centuria LifeGoals Pendal Sustainable Balanced Fund,OVS2591AU,Centuria,centuria.com.au
Centuria LifeGoals Russel Investments Balanced Fund,OVS9487AU,Centuria,centuria.com.au
Centuria LifeGoals Firetrail Australian High Conviction Fund,OVS5658AU,Centuria,centuria.com.au
Centuria LifeGoals Centuria Balanced Fund,OVS0011AU,Centuria,centuria.com.au
Centuria LifeGoals Fidelity Future Leaders in AU,OVS5444AU,Centuria,centuria.com.au
Centuria LifeGoals Magellan Infrastructure in AU,OVS0673AU,Centuria,centuria.com.au
Centuria LifeGoals Vanguard Australian Fixed Interest Index in AU,OVS5104AU,Centuria,centuria.com.au
Centuria LifeGoals Vanguard Australian Property Securities Index in AU,OVS5104AU,Centuria,centuria.com.au
Centuria LifeGoals Vanguard Diversified Balanced Index in AU,OVS4859AU,Centuria,centuria.com.au
Centuria Pendal Short Term Income Securities ,OVS5415AU,Centuria,centuria.com.au
CFM Institutional Systematic Diversified Trust A ,PIM0034AU,CFM Alta Beta,cfmaltbeta.com.au
CFM IS Trends Trust B ,PIM7962AU,CFM Alta Beta,cfmaltbeta.com.au
Chester High Conviction ,OPS7755AU,Chester,www.chesteram.com.au
ClearView CFML Antipodes Global ,CVW1890AU,Clearview,www.clearview.com.au
ClearView CFML Cash ,NRM0026AU,Clearview,www.clearview.com.au
ClearView CFML Colonial Infrastructure ,NRM0036AU,Clearview,www.clearview.com.au
ClearView CFML Fixed Interest ,NRM0030AU,Clearview,www.clearview.com.au
ClearView CFML Listed Property ,NRM0034AU,Clearview,www.clearview.com.au
ClearView CFML MFS International Shares ,NRM0032AU,Clearview,www.clearview.com.au
ClearView CFML RARE Emerging Markets ,NRM0038AU,Clearview,www.clearview.com.au
ClearView CFML Schroder Equity Opportunities ,NRM0028AU,Clearview,www.clearview.com.au
Clime Australian Fixed Interest Fund ,CLA0724AU,Clime,clime.com.au
Clime Australian Income Wholesale ,CLA0002AU,Clime,clime.com.au
Clime International Retail ,SLT0055AU,Clime,clime.com.au
Clime Smaller Companies Wholesale ,CLA1557AU,Clime,clime.com.au
Colchester Emerging Markets Bond I ,ETL3065AU,Colchester Global,colchesterglobal.com.au
Colchester Global Government Bond A ,ETL0409AU,Colchester Global,colchesterglobal.com.au
Colchester Global Government Bond I ,ETL5525AU,Colchester Global,colchesterglobal.com.au
Colchester Global Government Bond N ,ETL0467AU,Colchester Global,colchesterglobal.com.au
Cooper Investors Global Equities Hedged ,CIP0001AU,Cooper Investors,www.cooperinvestors.com
Cooper Investors Global Equities Unhedged ,CIP0003AU,Cooper Investors,www.cooperinvestors.com
Cor Capital Pty Ltd Cor Capital A ,COR0001AU,Cor Capital,corcapital.com.au
Cromwell Direct Property Fund ,CRM0018AU,Cromwell,www.cromwell.com.au
Cromwell Phoenix Property Securities ,CRM0008AU,Cromwell,www.cromwell.com.au
Daintree Core Income Trust NZD ,WPC0696AU,Daintree Capital,daintreecapital.com.au
Daintree Core Income Trust ,WPC1963AU,Daintree Capital,daintreecapital.com.au
Daintree High Income Trust NZD ,WPC0529AU,Daintree Capital,daintreecapital.com.au
Daintree High Income Trust ,WPC1583AU,Daintree Capital,daintreecapital.com.au
DDH Aggressive Growth ,QIN0001AU,DDH Graham,ddhgraham.com.au
DDH Australian Shares ,QIN0002AU,DDH Graham,ddhgraham.com.au
DDH Balanced Growth ,QIN0003AU,DDH Graham,ddhgraham.com.au
DDH Cash IDPS ,DDH0009AU,DDH Graham,ddhgraham.com.au
DDH Fixed Interest ,DDH0006AU,DDH Graham,ddhgraham.com.au
DDH Preferred Income ,DDH0001AU,DDH Graham,ddhgraham.com.au
DDH Selector Australian Equities ,DDH0002AU,DDH Graham,ddhgraham.com.au
DDH Selector High Conviction Equity A ,SEL0461AU ,DDH Graham,ddhgraham.com.au
Dimensional Australian Core Equity Trust ,DFA0003AU,Dimensional Fund Advisors,au.dimensional.com
Dimensional Australian Core Imputation Trust ,DFA0036AU,Dimensional Fund Advisors,au.dimensional.com
Dimensional Australian Large Company Trust ,DFA0103AU,Dimensional Fund Advisors,au.dimensional.com
Dimensional Australian Small Company Trust ,DFA0104AU,Dimensional Fund Advisors,au.dimensional.com
Dimensional Australian Sustainability Trust ,DFA2068AU,Dimensional Fund Advisors,au.dimensional.com
Dimensional Australian Value Trust ,DFA0101AU,Dimensional Fund Advisors,au.dimensional.com
Dimensional Emerging Markets Trust ,DFA0107AU,Dimensional Fund Advisors,au.dimensional.com
Dimensional Five Year Diversified Fixed Interest Trust AUD ,DFA0108AU,Dimensional Fund Advisors,au.dimensional.com
Dimensional Global Bond Sustainability Trust AUD AUD ,DFA0642AU,Dimensional Fund Advisors,au.dimensional.com
Dimensional Global Bond Trust AUD ,DFA0028AU,Dimensional Fund Advisors,au.dimensional.com
Dimensional Global Core Equity Trust Unhedged AUD ,DFA0004AU,Dimensional Fund Advisors,au.dimensional.com
Dimensional Global Large Company Trust ,DFA0105AU,Dimensional Fund Advisors,au.dimensional.com
Dimensional Global Real Estate Trust Inc AUD ,DFA0005AU,Dimensional Fund Advisors,au.dimensional.com
Dimensional Global Small Company Trust ,DFA0106AU,Dimensional Fund Advisors,au.dimensional.com
Dimensional Global Sustainability Trust Unhedged AUD ,DFA0041AU,Dimensional Fund Advisors,au.dimensional.com
Dimensional Global Value Trust ,DFA0102AU,Dimensional Fund Advisors,au.dimensional.com
Dimensional Short Term Fixed Interest Trust ,DFA0100AU,Dimensional Fund Advisors,au.dimensional.com
Dimensional World Allocation 50/50 Trust ,DFA0033AU,Dimensional Fund Advisors,au.dimensional.com
Dimensional World Equity Trust ,DFA0035AU,Dimensional Fund Advisors,au.dimensional.com
DSM Global Growth Equity ,ETL0199AU,DSM Capital,www.dsmcapital.com
Dundas Global Investors Apostle Dundas Global Equity C ,ETL0438AU,Apostle Fund Managers,apostlefm.com.au
Eiger Australian Small Companies A ,HOW2967AU,Eiger Capital,www.eigercapital.com
Eley Griffiths Group Emerging Companies ,PIM5346AU,Eley Griffiths,eleygriffithsgroup.com
Eley Griffiths Small Companies ,EGG0001AU,Eley Griffiths,eleygriffithsgroup.com
Ellerston  Australian Micro Cap Fund ,ECL0984AU,Ellerston Capital,ellerstoncapital.com
Ellerston Asia Growth Fund ,ECL1411AU,Ellerston Capital,ellerstoncapital.com
Ellerston Australian Absolute Return Fund A ,ECL0013AU,Ellerston Capital,ellerstoncapital.com
Ellerston Australian Emerging Leaders Fund ,ECL6748AU,Ellerston Capital,ellerstoncapital.com
Ellerston Global Equity Managers Fund – ,ECL0006AU,Ellerston Capital,ellerstoncapital.com
Ellerston Global Mid Small Cap Fund – Class A,ECL8388AU,Ellerston Capital,ellerstoncapital.com
Ellerston Overlay ASF ,ECL0012AU,Ellerston Capital,ellerstoncapital.com
Ellerstonn Share Fund – Class A ,ECL0005AU,Ellerston Capital,ellerstoncapital.com
Epoch Global Equity Shareholder Yield (Unhedged) ,GSF0002AU,GSFM,www.gsfm.com.au
Epoch Global Equity Shareholder Yield Hedged ,GSF0001AU,GSFM,www.gsfm.com.au
EQT Cash Management ,ETL0101AU,EQT,www.eqt.com.au
EQT Core International Equity ,ETL0107AU,EQT,www.eqt.com.au
EQT Diversified Fixed Income Retail ,ETL0420AU,EQT,www.eqt.com.au
EQT Flagship ,ETL0068AU,EQT,www.eqt.com.au
EQT Wholesale Flagship ,ETL5146AU,EQT,www.eqt.com.au
Equitable Dragonfly ,EQB7664AU,Equitable Investors,www.equitableinvestors.com.au
Evans And Partners International Hedged ,ETL0391AU,Evans And Partners,www.evansandpartners.com.au
Evans And Partners International ,ETL0390AU,Evans And Partners,www.evansandpartners.com.au
Fairview Equity Partners Emerging Companies ,ANT0002AU,Fairview Equity ,fairviewequity.com.au
Fidelity Australian Equities ,FID0008AU,Fidelity,www.fidelity.com.au
Fidelity Australian Opportunities ,FID0021AU,Fidelity,www.fidelity.com.au
Fidelity FIRST Global ,FID0026AU,Fidelity,www.fidelity.com.au
Fidelity Future Leaders ,FID5543AU,Fidelity,www.fidelity.com.au
Fidelity Global Demographics ,FID0023AU,Fidelity,www.fidelity.com.au
Fidelity Global Emerging Markets ,FID0031AU,Fidelity,www.fidelity.com.au
Fidelity Global Equities ,FID0007AU,Fidelity,www.fidelity.com.au
Fidelity Global Low Volatility Equity ,FID9876AU,Fidelity,www.fidelity.com.au
Firetrail Absolute Return A ,WHT5134AU,Firetrail,firetrail.com
Firetrail Australian High Conviction A ,WHT3810AU,Firetrail,firetrail.com
Firetrail Australian Small Companies Fund ,WHT3093AU,Firetrail ,firetrail.com
First Sentier First Sentier Global Listed Infrastructure Securities ,FSF1241AU,First Sentier Investors,www.firstsentierinvestors.com.au
First Sentier First Sentier Institutional Cash ,FSF0075AU,First Sentier Investors,www.firstsentierinvestors.com.au
Firstmac High Livez Retail ,PER0561AU,First Mac,www.firstmac.com.au
Flinders Emerging Companies B ,ETL0449AU,Flinders Invest,www.flindersinvest.com.au
Frame Futures D ,MSC0001AU,Frame Funds,www.framefunds.com.au
Freehold A-REITs & Listed Infrastructure ,LAM0042AU,Freehold,www.freeholdim.com.au
Freehold Australian Property ,LAM0044AU,Freehold,www.freeholdim.com.au
GCI Australian Capital Stable ,DDH8305AU,DDH Graham,ddhgraham.com.au
GCI Preferred Income Fund ,DDH0001AU,DDH Graham,ddhgraham.com.au
Global Value Investors Bendigo Global Share ,STL0015AU,Bendigo Bank,bendigobank.com.au
GQG Partners Emerging Markets Equity ,ETL4207AU,GQG Partners,gqgpartners.com
GQG Partners Global Equity ,ETL7377AU,GQG Partners,gqgpartners.com
